{
  "schema_version": "1.0.0",
  "data_version": "0.1.0-draft",
  "generated_at": "2026-09-07T10:05:18.360Z",
  "generated_by": "GK Studio vGKS-B884",
  "data": [
    {
      "id": "MAP-0001",
      "name": "実機検証用 訓練場",
      "status": "active",
      "enabled": true,
      "tags": [
        "TAG-0001",
        "TAG-0002",
        "TAG-0003"
      ],
      "params": {},
      "description": "Monster・Random Event・Reward集計の実機運用確認専用Map。",
      "updated_at": "2026-08-15T23:57:19.007Z"
    }
  ]
}
