{
  "schema_version": "1.0.0",
  "data_version": "0.1.0-draft",
  "generated_at": "2026-09-07T10:05:18.360Z",
  "generated_by": "GK Studio vGKS-B884",
  "data": [
    {
      "id": "QST-0006",
      "name": "実機検証4：Story Battle Override",
      "type": "guild",
      "status": "approved",
      "summary": "",
      "conditions": "",
      "completion": "",
      "failure": "",
      "rewards": "",
      "prerequisite_ids": [],
      "next_quest_ids": [],
      "required_flags": [],
      "set_flags": [],
      "start_cost": {
        "gold": 0,
        "resources": {}
      },
      "adventure_duration_seconds": 30,
      "base_enemy_budget": 7,
      "enemy_budget": 7,
      "context": {
        "map_id": "MAP-0001",
        "environment_tags": [
          "ops-test"
        ]
      },
      "boxes": [
        {
          "box_id": "BOX-0001",
          "name": "Box 1",
          "order": 1,
          "pre_scene_id": null,
          "mid_scene_id": null,
          "post_scene_id": null,
          "event_zone_before_pre": [
            {
              "kind": "fixed_event",
              "event_id": "EVT-0013",
              "failure_policy": "quest_fail",
              "order": 1,
              "encounter_override": {
                "mode": "required_monsters",
                "required_monsters": [
                  {
                    "monster_id": "MON-0004",
                    "count": 1
                  }
                ],
                "formation": [],
                "scaling_profile_ref": null
              }
            }
          ],
          "event_zone_pre_to_mid": [],
          "event_zone_mid_to_post": [],
          "event_zone_after_post": []
        }
      ],
      "updated_at": "2026-08-16T03:20:30.991Z",
      "created_at": "2026-08-16T03:20:30.991Z",
      "character_ids": []
    }
  ]
}
