{
  "schema_version": "1.0.0",
  "data_version": "0.1.0-draft",
  "generated_at": "2026-09-07T10:05:18.360Z",
  "generated_by": "GK Studio vGKS-B884",
  "data": [
    {
      "id": "FLG-0001",
      "name": "デモ2：失敗前Event到達",
      "category": "test",
      "default_value": false,
      "description": "QST-0003で必敗戦闘より前のEventが実行されたことを確認する実機検証Flag。",
      "updated_at": "2026-08-16T01:20:00.000Z"
    },
    {
      "id": "FLG-0002",
      "name": "デモ2：失敗後Event到達（到達禁止）",
      "category": "test",
      "default_value": false,
      "description": "QST-0003のquest_fail後に後続Eventが誤実行された場合だけONになる検出用Flag。正常時はOFFのまま。",
      "updated_at": "2026-08-16T01:20:00.000Z"
    }
  ]
}
