{
  "schema_version": "1.0.0",
  "data_version": "demo-0.1.6",
  "generated_at": "2026-08-16T07:14:03.200Z",
  "generated_by": "GK Studio vGKS-B594",
  "data": [
    {
      "id": "SEC-0001",
      "no": 1,
      "title": "新たな訓練の日",
      "summary": "アルフレッドは王子の身分を隠して近衛騎士団へ入り、新兵アルフとしてランスと出会う。初日の終わり、翌日の実戦形式訓練が告げられる。",
      "purpose": "物語の主人公・目的・秘密を提示し、騎士団での新たな日常と次節への期待を作る。",
      "start_state": "アルフレッドは王城で、王子としての身分を一時的に捨てる朝を迎えている。",
      "end_state": "アルフレッドは新兵アルフとして騎士団に入り、ランスと知り合い、翌日の実戦形式訓練を待つ。",
      "key_points": "身分を隠して入隊／レオンだけが正体を知る／ランスとの出会い／実戦形式訓練の予告",
      "status": "draft",
      "created_at": "2026-08-14T06:50:00.000Z",
      "updated_at": "2026-08-14T06:50:00.000Z",
      "chapter_id": "CHP-0001"
    }
  ]
}
