{
  "schema_version": "1.0.0",
  "data_version": "0.1.0-draft",
  "generated_at": "2026-09-09T03:34:47.885Z",
  "generated_by": "GK Studio vGKS-B892",
  "data": [
    {
      "id": "MON-0001",
      "name": "訓練用スライム",
      "status": "active",
      "tags": [
        "TAG-0001",
        "TAG-0002"
      ],
      "params": {
        "maxHp": 21,
        "attack": 2,
        "agi": 0.4,
        "enemy_budget_cost": 1,
        "spawn_weight": 3,
        "spawn_tags": {
          "any": [],
          "all": [
            "ops-test"
          ],
          "none": []
        },
        "drop_table_ids": [
          "RWD-0001"
        ],
        "job_id": "JOB-0001",
        "level": 1,
        "maxMp": 0,
        "str": 1.5,
        "vit": 1.3,
        "dex": 1,
        "int": 0.7,
        "mnd": 0.8,
        "luk": 0.3
      },
      "description": "実機検証用。Enemy Budget 1。撃破報酬はGold 10＋戦闘トークン1。",
      "updated_at": "2026-09-08T12:19:48.932Z",
      "default_formation_position": "FRONTLINE",
      "formalAiBinding": {
        "program_id": "AIP-0001",
        "layout_id": "AIL-0001"
      }
    },
    {
      "id": "MON-0002",
      "name": "訓練用ゴブリン",
      "status": "active",
      "enabled": true,
      "tags": [
        "TAG-0001",
        "TAG-0002"
      ],
      "params": {
        "maxHp": 28,
        "attack": 3,
        "agi": 0.4,
        "enemy_budget_cost": 2,
        "spawn_weight": 1,
        "spawn_tags": {
          "any": [],
          "all": [
            "ops-test"
          ],
          "none": []
        },
        "drop_table_ids": [
          "RWD-0002"
        ],
        "job_id": "JOB-0001",
        "level": 1,
        "maxMp": 0,
        "str": 1.5,
        "vit": 1.3,
        "dex": 1,
        "int": 0.7,
        "mnd": 0.8,
        "luk": 0.3
      },
      "description": "実機検証用。Enemy Budget 2。撃破報酬はGold 20＋戦闘トークン2。",
      "updated_at": "2026-08-15T23:57:19.007Z",
      "default_formation_position": "FRONTLINE",
      "formalAiBinding": {
        "program_id": "AIP-0001",
        "layout_id": "AIL-0001"
      }
    },
    {
      "id": "MON-0003",
      "name": "デモ2訓練守護者",
      "status": "active",
      "enabled": true,
      "tags": [
        "TAG-0001",
        "TAG-0002"
      ],
      "params": {
        "maxHp": 900,
        "attack": 58,
        "agi": 0.4,
        "enemy_budget_cost": 10,
        "spawn_weight": 1,
        "spawn_tags": {
          "any": [],
          "all": [
            "demo2-fail"
          ],
          "none": []
        },
        "drop_table_ids": [],
        "job_id": "JOB-0001",
        "level": 1,
        "maxMp": 0,
        "str": 1.5,
        "vit": 1.3,
        "dex": 1,
        "int": 0.7,
        "mnd": 0.8,
        "luk": 0.3
      },
      "description": "デモテスト2専用。基礎能力は現行Game内のCランク守護者相当を基準とし、必敗性は固定の異常値ではなくQuest Enemy Budget 400によるBudget編成（40体）で作る。",
      "updated_at": "2026-08-16T01:20:00.000Z",
      "default_formation_position": "FRONTLINE",
      "formalAiBinding": {
        "program_id": "AIP-0001",
        "layout_id": "AIL-0001"
      }
    },
    {
      "id": "MON-0004",
      "name": "デモ4 指定訓練隊長",
      "status": "active",
      "tags": [
        "TAG-0001",
        "TAG-0002"
      ],
      "params": {
        "maxHp": 45,
        "attack": 4,
        "agi": 0.4,
        "spawn_weight": 1,
        "enemy_budget_cost": 3,
        "spawn_tags": {
          "any": [],
          "all": [
            "demo4-required-only"
          ],
          "none": []
        },
        "drop_table_ids": [
          "RWD-0011"
        ],
        "job_id": "JOB-0001",
        "level": 1,
        "maxMp": 0,
        "str": 1.5,
        "vit": 1.3,
        "dex": 1,
        "int": 0.7,
        "mnd": 0.8,
        "luk": 0.3
      },
      "description": "",
      "updated_at": "2026-08-16T03:01:08.292Z",
      "default_formation_position": "FRONTLINE",
      "formalAiBinding": {
        "program_id": "AIP-0001",
        "layout_id": "AIL-0001"
      }
    }
  ]
}
