{
  "schema_version": "1.0.0",
  "data_version": "0.1.0-draft",
  "generated_at": "2026-09-07T10:05:18.360Z",
  "generated_by": "GK Studio vGKS-B884",
  "data": [
    {
      "id": "EXP-0001",
      "name": "デモ3 共鳴探索・通常発見",
      "status": "active",
      "enabled": true,
      "tags": [
        "TAG-0001"
      ],
      "params": {
        "environment_tags": {
          "any": [],
          "all": [
            "demo3-exploration",
            "demo3-stone-active"
          ],
          "none": []
        },
        "rarity": "common",
        "base_weight": 10,
        "success": {
          "base_rate": 0.4,
          "min_rate": 0,
          "max_rate": 1
        },
        "on_success": {
          "text": "石板の共鳴により通常の補給箱を発見した。",
          "reward_table_ids": [
            "RWD-0007"
          ]
        },
        "on_failure": {
          "text": "共鳴を追跡したが発見には至らなかった。",
          "reward_table_ids": [
            "RWD-0009"
          ]
        }
      },
      "description": "デモ3探索候補（Common）。Stoneが付与するdemo3-stone-activeがない場合は候補にならない。",
      "updated_at": "2026-08-16T01:41:00.000Z"
    },
    {
      "id": "EXP-0002",
      "name": "デモ3 共鳴探索・希少発見",
      "status": "active",
      "enabled": true,
      "tags": [
        "TAG-0001"
      ],
      "params": {
        "environment_tags": {
          "any": [],
          "all": [
            "demo3-exploration",
            "demo3-stone-active"
          ],
          "none": []
        },
        "rarity": "rare",
        "base_weight": 10,
        "success": {
          "base_rate": 0.4,
          "min_rate": 0,
          "max_rate": 1
        },
        "on_success": {
          "text": "石板が強く共鳴し、希少な補給箱を発見した。",
          "reward_table_ids": [
            "RWD-0008"
          ]
        },
        "on_failure": {
          "text": "強い共鳴を追跡したが発見には至らなかった。",
          "reward_table_ids": [
            "RWD-0009"
          ]
        }
      },
      "description": "デモ3探索候補（Rare）。Effective BudgetによりRare weightが上昇する。Stone環境タグがない場合は候補にならない。",
      "updated_at": "2026-08-16T01:41:00.000Z"
    }
  ]
}
