{
  "schema_version": "2.0.0",
  "data_version": "0.1.0-draft",
  "generated_at": "2026-09-07T10:05:18.360Z",
  "generated_by": "GK Studio vGKS-B884",
  "data": [
    {
      "compiler_version": "2.0.0",
      "content_hash": "794ae7031859051619ead42ac4be9739145fa85a8f1f4c062213878b8083b5d4",
      "data_version": "0.1.0-draft",
      "entry_instruction": "I-0001",
      "instructions": [
        {
          "evaluator": "action.attack",
          "instruction_id": "I-0001",
          "master_node_id": "AIA-0001",
          "op": "ACTION",
          "origin_part_id": "AIN-0001",
          "params": {},
          "source_node_id": "AIN-0001",
          "target_selector": {
            "params": {},
            "selector_id": "ATS-0001"
          }
        }
      ],
      "limits": {
        "max_steps": 1,
        "max_subroutine_depth": 0
      },
      "program_id": "AIP-0001",
      "program_version": 1,
      "schema_version": "2.0.0",
      "source_map": {
        "I-0001": {
          "origin_part_id": "AIN-0001",
          "source_node_id": "AIN-0001"
        }
      }
    }
  ]
}
