{
  "schema_version": "1.0.0",
  "data_version": "demo-0.1.0",
  "generated_at": "2026-08-15T22:12:42.841Z",
  "generated_by": "GK Studio vGKS-B592",
  "data": [
    {
      "id": "CHP-0001",
      "no": 1,
      "title": "草原の新兵",
      "theme": "王になる前に、民・騎士・兵士の現実を知る",
      "summary": "アルディア王国第一王子アルフレッドは身分を隠し、新兵「アルフ」として近衛騎士団へ入隊する。同期のランスと出会い、王になるための最初の一歩を踏み出す。",
      "purpose": "主人公アルフレッドの立場と目的を提示し、身分を隠した新兵生活の開始を描く。",
      "status": "draft",
      "created_at": "2026-08-14T06:50:00.000Z",
      "updated_at": "2026-08-15T01:17:52.299Z",
      "available_monster_ids": [],
      "random_event_candidates": []
    }
  ]
}
