{
  "schema_version": "1.0.0",
  "data_version": "0.1.0-draft",
  "generated_at": "2026-09-07T10:05:18.360Z",
  "generated_by": "GK Studio vGKS-B884",
  "data": [
    {
      "id": "RWD-0001",
      "name": "実機検証 Monster Drop / Budget 1",
      "status": "active",
      "enabled": true,
      "tags": [
        "TAG-0001",
        "TAG-0004"
      ],
      "params": {
        "mode": "independent",
        "entries": [
          {
            "kind": "gold",
            "amount": 10,
            "rate": 1,
            "scaling_mode": "none"
          },
          {
            "kind": "material",
            "resource_id": "MAT-OPS-BATTLE-TOKEN",
            "amount": 1,
            "rate": 1,
            "scaling_mode": "none"
          }
        ]
      },
      "description": "Enemy Budget 1につきGold 10＋戦闘トークン1。",
      "updated_at": "2026-08-15T23:57:19.007Z"
    },
    {
      "id": "RWD-0002",
      "name": "実機検証 Monster Drop / Budget 2",
      "status": "active",
      "enabled": true,
      "tags": [
        "TAG-0001",
        "TAG-0004"
      ],
      "params": {
        "mode": "independent",
        "entries": [
          {
            "kind": "gold",
            "amount": 20,
            "rate": 1,
            "scaling_mode": "none"
          },
          {
            "kind": "material",
            "resource_id": "MAT-OPS-BATTLE-TOKEN",
            "amount": 2,
            "rate": 1,
            "scaling_mode": "none"
          }
        ]
      },
      "description": "Enemy Budget 2につきGold 20＋戦闘トークン2。",
      "updated_at": "2026-08-15T23:57:19.007Z"
    },
    {
      "id": "RWD-0003",
      "name": "実機検証 Random Event Reward",
      "status": "active",
      "enabled": true,
      "tags": [
        "TAG-0001",
        "TAG-0005"
      ],
      "params": {
        "mode": "independent",
        "entries": [
          {
            "kind": "gold",
            "amount": 70,
            "rate": 1,
            "scaling_mode": "none"
          },
          {
            "kind": "material",
            "resource_id": "MAT-OPS-EVENT-TOKEN",
            "amount": 2,
            "rate": 1,
            "scaling_mode": "none"
          }
        ]
      },
      "description": "Random報酬Event確認用。Gold 70＋Eventトークン2。",
      "updated_at": "2026-08-15T23:57:19.007Z"
    },
    {
      "id": "RWD-0004",
      "name": "デモ2 失敗前の仮報酬",
      "status": "active",
      "enabled": true,
      "tags": [
        "TAG-0001",
        "TAG-0005"
      ],
      "params": {
        "mode": "independent",
        "entries": [
          {
            "kind": "gold",
            "amount": 11,
            "rate": 1,
            "scaling_mode": "none"
          },
          {
            "kind": "material",
            "resource_id": "MAT-DEMO2-PRE-FAIL",
            "amount": 1,
            "rate": 1,
            "scaling_mode": "none"
          }
        ]
      },
      "description": "必敗戦闘前に一度確定させる検出用報酬。Quest失敗時は最終Saveへ反映されないことを確認する。",
      "updated_at": "2026-08-16T01:20:00.000Z"
    },
    {
      "id": "RWD-0005",
      "name": "デモ2 失敗後の到達禁止報酬",
      "status": "active",
      "enabled": true,
      "tags": [
        "TAG-0001",
        "TAG-0005"
      ],
      "params": {
        "mode": "independent",
        "entries": [
          {
            "kind": "gold",
            "amount": 999,
            "rate": 1,
            "scaling_mode": "none"
          },
          {
            "kind": "material",
            "resource_id": "MAT-DEMO2-AFTER-FAIL",
            "amount": 9,
            "rate": 1,
            "scaling_mode": "none"
          }
        ]
      },
      "description": "quest_fail後のEventが誤実行された場合だけ見える検出用報酬。正常時はEvent自体が実行されない。",
      "updated_at": "2026-08-16T01:20:00.000Z"
    },
    {
      "id": "RWD-0006",
      "name": "デモ3 準備用石板支給",
      "status": "active",
      "enabled": true,
      "tags": [
        "TAG-0001",
        "TAG-0005"
      ],
      "params": {
        "mode": "independent",
        "entries": [
          {
            "kind": "stone",
            "stone_id": "TBL-0001",
            "amount": 3,
            "rate": 1,
            "scaling_mode": "none"
          }
        ]
      },
      "description": "デモ3準備Quest完了時に探索共鳴石板を3個支給する。",
      "updated_at": "2026-08-16T01:41:00.000Z"
    },
    {
      "id": "RWD-0007",
      "name": "デモ3 探索Common成功報酬",
      "status": "active",
      "enabled": true,
      "tags": [
        "TAG-0001",
        "TAG-0005"
      ],
      "params": {
        "mode": "independent",
        "entries": [
          {
            "kind": "gold",
            "amount": 20,
            "rate": 1,
            "scaling_mode": "none"
          },
          {
            "kind": "material",
            "resource_id": "MAT-DEMO3-EXP-COMMON",
            "amount": 1,
            "rate": 1,
            "scaling_mode": "none"
          }
        ]
      },
      "description": "Common探索結果識別用。Gold20＋Common token1。探索はBudget数量倍率を掛けない。",
      "updated_at": "2026-08-16T01:41:00.000Z"
    },
    {
      "id": "RWD-0008",
      "name": "デモ3 探索Rare成功報酬",
      "status": "active",
      "enabled": true,
      "tags": [
        "TAG-0001",
        "TAG-0005"
      ],
      "params": {
        "mode": "independent",
        "entries": [
          {
            "kind": "gold",
            "amount": 20,
            "rate": 1,
            "scaling_mode": "none"
          },
          {
            "kind": "material",
            "resource_id": "MAT-DEMO3-EXP-RARE",
            "amount": 1,
            "rate": 1,
            "scaling_mode": "none"
          }
        ]
      },
      "description": "Rare探索結果識別用。Gold20＋Rare token1。再開後も同じtokenが表示されることを確認する。",
      "updated_at": "2026-08-16T01:41:00.000Z"
    },
    {
      "id": "RWD-0009",
      "name": "デモ3 探索失敗識別報酬",
      "status": "active",
      "enabled": true,
      "tags": [
        "TAG-0001",
        "TAG-0005"
      ],
      "params": {
        "mode": "independent",
        "entries": [
          {
            "kind": "material",
            "resource_id": "MAT-DEMO3-EXP-FAIL",
            "amount": 1,
            "rate": 1,
            "scaling_mode": "none"
          }
        ]
      },
      "description": "探索チェック失敗を識別するためのtoken。石板1個投入時は成功率1.00なので通常は出ない。",
      "updated_at": "2026-08-16T01:41:00.000Z"
    },
    {
      "id": "RWD-0010",
      "name": "デモ3 Stone Budget補正確認報酬",
      "status": "active",
      "enabled": true,
      "tags": [
        "TAG-0001",
        "TAG-0005"
      ],
      "params": {
        "mode": "independent",
        "entries": [
          {
            "kind": "gold",
            "amount": 10,
            "rate": 1,
            "scaling_mode": "amount"
          },
          {
            "kind": "material",
            "resource_id": "MAT-DEMO3-CHECKPOINT",
            "amount": 1,
            "rate": 1,
            "scaling_mode": "none"
          }
        ]
      },
      "description": "本体Quest終盤のSpecial Event。石板1個でBudget delta20→現設定のEvent報酬補正×1.40となりGold14を期待。",
      "updated_at": "2026-08-16T01:41:00.000Z"
    },
    {
      "id": "RWD-0011",
      "name": "デモ4 指定敵Drop",
      "status": "active",
      "tags": [
        "TAG-0004",
        "TAG-0001"
      ],
      "params": {
        "mode": "independent",
        "entries": [
          {
            "kind": "gold",
            "amount": 30,
            "rate": 1,
            "scaling_mode": "none"
          },
          {
            "kind": "material",
            "resource_id": "MAT-DEMO4-REQUIRED",
            "amount": 3,
            "rate": 1,
            "scaling_mode": "none"
          }
        ]
      },
      "description": "",
      "updated_at": "2026-08-16T02:59:01.259Z"
    }
  ]
}
