{
  "schema_version": "1.0.0",
  "data_version": "0.1.0-draft",
  "generated_at": "2026-09-07T10:05:18.360Z",
  "generated_by": "GK Studio vGKS-B884",
  "data": [
    {
      "id": "EVT-0001",
      "name": "王子の身分を隠す決意",
      "usage": "story",
      "type": "special",
      "status": "draft",
      "enabled": true,
      "group": "CH01-SEC01",
      "tags": [
        "story",
        "chapter1",
        "section1",
        "identity"
      ],
      "intensity": "low",
      "random_base_weight": 1,
      "generation_profile_ref": null,
      "summary": "アルフレッドが王族としての身分を隠し、新兵アルフとして騎士団へ入る決意を固める。",
      "results": "物語進行イベント。報酬・Flag変更なし。",
      "required_flags": [],
      "set_flags": [],
      "reward_table_ids": [],
      "created_at": "2026-08-15T01:32:28.917Z",
      "updated_at": "2026-08-15T01:32:28.917Z",
      "conditions": ""
    },
    {
      "id": "EVT-0002",
      "name": "王城を後にする",
      "usage": "story",
      "type": "special",
      "status": "draft",
      "enabled": true,
      "group": "CH01-SEC01",
      "tags": [
        "story",
        "chapter1",
        "section1",
        "departure"
      ],
      "intensity": "low",
      "random_base_weight": 1,
      "generation_profile_ref": null,
      "summary": "革鎧を身につけたアルフレッドが、王子ではなく一人の新兵として王城を後にする。",
      "results": "物語進行イベント。報酬・Flag変更なし。",
      "required_flags": [],
      "set_flags": [],
      "reward_table_ids": [],
      "created_at": "2026-08-15T01:32:28.917Z",
      "updated_at": "2026-08-15T01:32:28.917Z",
      "conditions": ""
    },
    {
      "id": "EVT-0003",
      "name": "ランスとの出会い",
      "usage": "story",
      "type": "special",
      "status": "draft",
      "enabled": true,
      "group": "CH01-SEC01",
      "tags": [
        "story",
        "chapter1",
        "section1",
        "encounter"
      ],
      "intensity": "low",
      "random_base_weight": 1,
      "generation_profile_ref": null,
      "summary": "新兵アルフとして騎士団に入ったアルフレッドが、同期のランスと出会い握手を交わす。",
      "results": "物語進行イベント。報酬・Flag変更なし。",
      "required_flags": [],
      "set_flags": [],
      "reward_table_ids": [],
      "created_at": "2026-08-15T01:32:28.917Z",
      "updated_at": "2026-08-15T01:32:28.917Z",
      "conditions": ""
    },
    {
      "id": "EVT-0004",
      "name": "実戦形式訓練の告知",
      "usage": "story",
      "type": "special",
      "status": "draft",
      "enabled": true,
      "group": "CH01-SEC01",
      "tags": [
        "story",
        "chapter1",
        "section1",
        "training"
      ],
      "intensity": "low",
      "random_base_weight": 1,
      "generation_profile_ref": null,
      "summary": "初日の終わりにレオンが、翌日は実戦形式の訓練を行うと新兵たちへ告げる。",
      "results": "次節への予告となる物語進行イベント。報酬・Flag変更なし。",
      "required_flags": [],
      "set_flags": [],
      "reward_table_ids": [],
      "created_at": "2026-08-15T01:32:28.917Z",
      "updated_at": "2026-08-15T01:32:28.917Z",
      "conditions": ""
    },
    {
      "status": "active",
      "enabled": true,
      "group": "OPS-E2E",
      "intensity": "normal",
      "random_base_weight": 1,
      "generation_profile_ref": null,
      "required_flags": [],
      "set_flags": [],
      "conditions": "",
      "created_at": "2026-08-15T23:57:19.007Z",
      "updated_at": "2026-08-15T23:57:19.007Z",
      "id": "EVT-0005",
      "name": "実機検証：ランダム訓練戦闘",
      "usage": "random",
      "type": "battle",
      "tags": [
        "ops-test",
        "battle"
      ],
      "summary": "訓練場のモンスターからEnemy Budget 3の編成をランダム生成して戦闘する。",
      "results": "勝利時、Monster Dropの合計はGold 30＋MAT-OPS-BATTLE-TOKEN 3個。",
      "reward_table_ids": []
    },
    {
      "status": "active",
      "enabled": true,
      "group": "OPS-E2E",
      "intensity": "normal",
      "random_base_weight": 1,
      "generation_profile_ref": null,
      "required_flags": [],
      "set_flags": [],
      "conditions": "",
      "created_at": "2026-08-15T23:57:19.007Z",
      "updated_at": "2026-08-15T23:57:19.007Z",
      "id": "EVT-0006",
      "name": "実機検証：ランダム補給報酬",
      "usage": "random",
      "type": "special",
      "tags": [
        "ops-test",
        "reward"
      ],
      "summary": "戦闘後に補給物資を発見するRandom Event。",
      "results": "Gold 70＋MAT-OPS-EVENT-TOKEN 2個を確定する。",
      "reward_table_ids": [
        "RWD-0003"
      ]
    },
    {
      "usage": "story",
      "status": "active",
      "enabled": true,
      "group": "OPS-FAIL-E2E",
      "intensity": "low",
      "random_base_weight": 1,
      "generation_profile_ref": null,
      "required_flags": [],
      "conditions": "",
      "created_at": "2026-08-16T01:20:00.000Z",
      "updated_at": "2026-08-16T01:20:00.000Z",
      "id": "EVT-0007",
      "name": "デモ2：失敗前の補給確認",
      "type": "special",
      "tags": [
        "demo2-fail",
        "pre-fail"
      ],
      "summary": "必敗戦闘の前に仮報酬と到達Flagを確定する。",
      "results": "Gold 11＋MAT-DEMO2-PRE-FAIL 1。Quest失敗時は報酬は全損する。",
      "set_flags": [
        "FLG-0001"
      ],
      "reward_table_ids": [
        "RWD-0004"
      ]
    },
    {
      "usage": "story",
      "status": "active",
      "enabled": true,
      "group": "OPS-FAIL-E2E",
      "intensity": "extreme",
      "random_base_weight": 1,
      "generation_profile_ref": null,
      "required_flags": [],
      "conditions": "",
      "created_at": "2026-08-16T01:20:00.000Z",
      "updated_at": "2026-08-16T01:20:00.000Z",
      "id": "EVT-0008",
      "name": "デモ2：Budget圧力・訓練守護者群",
      "type": "battle",
      "tags": [
        "demo2-fail",
        "battle",
        "forced-defeat"
      ],
      "summary": "Mapタグ＋Enemy Budgetの通常Resolverで訓練守護者群を生成し、quest_failによるQuest失敗経路を確認する。",
      "results": "Enemy Budget 400 / Cost 10により40体編成。敗北してQuest失敗し、後続Eventは処理されない。",
      "set_flags": [],
      "reward_table_ids": []
    },
    {
      "usage": "story",
      "status": "active",
      "enabled": true,
      "group": "OPS-FAIL-E2E",
      "intensity": "low",
      "random_base_weight": 1,
      "generation_profile_ref": null,
      "required_flags": [],
      "conditions": "",
      "created_at": "2026-08-16T01:20:00.000Z",
      "updated_at": "2026-08-16T01:20:00.000Z",
      "id": "EVT-0009",
      "name": "デモ2：失敗後の到達禁止Event",
      "type": "special",
      "tags": [
        "demo2-fail",
        "after-fail",
        "sentinel"
      ],
      "summary": "必敗戦闘より後ろに置く検出用Event。quest_failが正常なら実行されない。",
      "results": "誤実行時だけGold 999＋MAT-DEMO2-AFTER-FAIL 9とFLG-0002が発生する。正常時は何も発生しない。",
      "set_flags": [
        "FLG-0002"
      ],
      "reward_table_ids": [
        "RWD-0005"
      ]
    },
    {
      "usage": "story",
      "status": "active",
      "enabled": true,
      "group": "OPS-STONE-EXP-E2E",
      "intensity": "low",
      "random_base_weight": 1,
      "generation_profile_ref": null,
      "required_flags": [],
      "set_flags": [],
      "conditions": "",
      "created_at": "2026-08-16T01:41:00.000Z",
      "updated_at": "2026-08-16T01:41:00.000Z",
      "id": "EVT-0010",
      "name": "デモ3準備：探索共鳴石板の支給",
      "type": "special",
      "tags": [
        "demo3",
        "stone",
        "prepare"
      ],
      "summary": "デモ3本体で使用する探索共鳴石板を支給する。",
      "results": "TBL-0001を3個獲得。帰還Commit後、依頼画面の石板UIで所持数を確認する。",
      "reward_table_ids": [
        "RWD-0006"
      ]
    },
    {
      "usage": "story",
      "status": "active",
      "enabled": true,
      "group": "OPS-STONE-EXP-E2E",
      "intensity": "low",
      "random_base_weight": 1,
      "generation_profile_ref": null,
      "required_flags": [],
      "set_flags": [],
      "conditions": "",
      "created_at": "2026-08-16T01:41:00.000Z",
      "updated_at": "2026-08-16T01:41:00.000Z",
      "id": "EVT-0011",
      "name": "デモ3：石板共鳴探索",
      "type": "exploration",
      "tags": [
        "demo3",
        "exploration",
        "stone"
      ],
      "summary": "Stone環境タグとEffective Budgetを使って探索Outcomeを抽選する。",
      "results": "Stone1個投入時は成功率1.00。Common/RareのどちらかをSnapshotし、再読込後も同じ結果を保持する。",
      "reward_table_ids": []
    },
    {
      "usage": "story",
      "status": "active",
      "enabled": true,
      "group": "OPS-STONE-EXP-E2E",
      "intensity": "low",
      "random_base_weight": 1,
      "generation_profile_ref": null,
      "required_flags": [],
      "set_flags": [],
      "conditions": "",
      "created_at": "2026-08-16T01:41:00.000Z",
      "updated_at": "2026-08-16T01:41:00.000Z",
      "id": "EVT-0012",
      "name": "デモ3：再開後チェックポイント",
      "type": "special",
      "tags": [
        "demo3",
        "resume",
        "reward"
      ],
      "summary": "探索結果確認後の再開・Snapshot固定とStone Budget報酬補正を確認する。",
      "results": "石板1個投入時はGold14＋MAT-DEMO3-CHECKPOINT 1を期待。",
      "reward_table_ids": [
        "RWD-0010"
      ]
    },
    {
      "id": "EVT-0013",
      "name": "デモ4：Story Battle Override戦",
      "usage": "story",
      "type": "battle",
      "status": "approved",
      "enabled": true,
      "group": "OPS-OVERRIDE-E2E",
      "tags": [
        "demo4",
        "story-battle-override"
      ],
      "intensity": "normal",
      "random_base_weight": 1,
      "generation_profile_ref": null,
      "reward_table_ids": [],
      "summary": "required_monsters＋残Budget生成を確認するBattle。",
      "conditions": "",
      "results": "MON-0004を必須1体、残Budgetは通常Resolverで生成。",
      "required_flags": [],
      "set_flags": [],
      "updated_at": "2026-08-16T03:10:38.813Z",
      "created_at": "2026-08-16T03:10:38.813Z"
    }
  ]
}
