{
  "schema_version": "2.0.0",
  "data_version": "0.1.0-draft",
  "generated_at": "2026-09-07T10:05:18.360Z",
  "generated_by": "GK Studio vGKS-B884",
  "data": [
    {
      "schema_version": "2.0.0",
      "data_version": "0.1.0-draft",
      "layout_id": "AIL-0001",
      "program_id": "AIP-0001",
      "width": 8,
      "height": 8,
      "chips": [
        {
          "instance_id": "AIN-0001",
          "x": 0,
          "y": 0,
          "rotation": 0
        }
      ],
      "extensions": []
    }
  ]
}
