{
  "schema_version": "2.0.0",
  "data_version": "0.1.0-draft",
  "generated_at": "2026-09-07T10:05:18.360Z",
  "generated_by": "GK Studio vGKS-B884",
  "data": [
    {
      "id": "AIP-0001",
      "data_version": "0.1.0-draft",
      "name": "Monster共通AI: HP最少の敵へ通常攻撃",
      "updated_at": "2026-09-01T08:55:08.072Z",
      "status": "valid",
      "entry_node_id": "AIN-0001",
      "nodes": [
        {
          "instance_id": "AIN-0001",
          "master_node_id": "AIA-0001",
          "master_data_version": "0.1.0-draft",
          "node_type": "action",
          "position": {
            "x": 0,
            "y": 0
          },
          "parameters": {},
          "target_selector": {
            "selector_id": "ATS-0001",
            "params": {}
          },
          "comment": "Human-fixed P9 Developer Program mapping"
        }
      ],
      "edges": [],
      "subroutines": [],
      "tags": [],
      "description": "Human-fixed P9 Developer Program: HP最少の敵 → 通常攻撃.",
      "schema_version": "2.0.0",
      "version": 1,
      "result_slots": []
    }
  ]
}
