{
  "schema_version": "1.0.0",
  "data_version": "0.1.0-draft",
  "generated_at": "2026-09-07T10:05:18.360Z",
  "generated_by": "GK Studio vGKS-B884",
  "data": [
    {
      "id": "TBL-0001",
      "name": "デモ3 探索共鳴石板",
      "status": "active",
      "enabled": true,
      "tags": [
        "TAG-0001"
      ],
      "params": {
        "stone_level": 20,
        "enemy_budget_bonus": 20,
        "exploration_success_rate_add": 0.6,
        "environment_tags_add": [
          "demo3-stone-active"
        ],
        "environment_tags_remove": []
      },
      "description": "デモテスト3専用。投入1個でEnemy Budget +20。探索成功率+0.60と探索用環境タグを付与し、Stone投入・探索・再開Snapshot固定を検証する。",
      "updated_at": "2026-08-16T01:41:00.000Z"
    }
  ]
}
