{
  "schema_version": "2.0.0",
  "data_version": "0.1.0-draft",
  "generated_at": "2026-09-07T10:05:18.360Z",
  "generated_by": "GK Studio vGKS-B884",
  "data": [
    {
      "schema_version": "2.0.0",
      "id": "ATS-0001",
      "name": "HP割合が最も低い対象",
      "evaluator": "selector.lowest_hp_ratio",
      "parameter_schema": {
        "type": "object",
        "properties": {},
        "required": [],
        "additionalProperties": false
      },
      "tags": [],
      "enabled": true,
      "status": "draft",
      "description": ""
    }
  ]
}
