{
  "schema_version": "1.0.0",
  "data_version": "demo-0.1.6",
  "generated_at": "2026-08-16T07:14:03.200Z",
  "generated_by": "GK Studio vGKS-B594",
  "data": [
    {
      "id": "QST-0001",
      "name": "1-1 新たな訓練の日",
      "type": "main",
      "status": "draft",
      "summary": "アルフレッドは王子の身分を隠して近衛騎士団へ入り、新兵アルフとしてランスと出会う。初日の終わり、翌日の実戦形式訓練が告げられる。",
      "adventure_duration_seconds": 300,
      "base_enemy_budget": 0,
      "enemy_budget": 0,
      "start_cost": {
        "gold": 0,
        "resources": {}
      },
      "prerequisite_ids": [],
      "next_quest_ids": [],
      "required_flags": [],
      "set_flags": [],
      "context": {
        "map_id": "",
        "environment_tags": [
          "grassland",
          "capital",
          "training_ground"
        ]
      },
      "boxes": [
        {
          "box_id": "BOX-QST-CH01-SEC01-01",
          "name": "1-1 新たな訓練のひ",
          "order": 1,
          "pre_scene_id": "SCN-0001",
          "mid_scene_id": "SCN-0002",
          "post_scene_id": "SCN-0003",
          "event_zone_before_pre": [
            {
              "kind": "fixed_event",
              "order": 1,
              "failure_policy": "continue",
              "event_id": "EVT-0001"
            }
          ],
          "event_zone_pre_to_mid": [
            {
              "kind": "fixed_event",
              "order": 1,
              "failure_policy": "continue",
              "event_id": "EVT-0002"
            }
          ],
          "event_zone_mid_to_post": [
            {
              "kind": "fixed_event",
              "order": 1,
              "failure_policy": "continue",
              "event_id": "EVT-0003"
            }
          ],
          "event_zone_after_post": [
            {
              "kind": "fixed_event",
              "order": 1,
              "failure_policy": "continue",
              "event_id": "EVT-0004"
            }
          ]
        }
      ],
      "created_at": "2026-08-15T01:32:54.268Z",
      "updated_at": "2026-08-15T08:51:58.782Z",
      "conditions": "",
      "completion": "",
      "rewards": "",
      "failure": "",
      "character_ids": []
    }
  ]
}
